{
  "schema_version": "1.0",
  "analysis_id": "ANALYSIS_SOUTH_CHINA_SEA_001",
  "situation": {
    "situation_id": "SIT_SOUTH_CHINA_SEA_001",
    "name": "Situation sociale internationale de la mer de Chine méridionale",
    "scope": {
      "geographic": "Mer de Chine méridionale (Spratleys, Paracels, récif de Scarborough, Second Thomas Shoal)",
      "temporal": "Phase contemporaine",
      "fields": ["MIL", "LEGAL", "DIP", "ECO", "ENERGY", "SYM", "INF"]
    },
    "situation_type": ["SECURITY_TENSION", "NORMATIVE_CONFLICT", "REGIONAL_ORDER_STRESS"],
    "current_phase": "gray_zone_coercion_below_armed_conflict"
  },
  "actors": [
    {
      "schema_version": "1.0",
      "actor_id": "ACT_CHINA",
      "name": "République populaire de Chine",
      "actor_type": "STATE",
      "aliases": ["PRC"],
      "description": "État revendiquant des droits historiques étendus (ligne en neuf traits) et établissant un contrôle de fait par présence paramilitaire et constructions insulaires.",
      "primary_fields": ["MIL", "DIP", "LEGAL", "SYM"],
      "claimed_roles": ["legitimate_sovereign", "regional_order_setter"],
      "recognized_roles": ["major_power"],
      "contested_roles": ["lawful_claimant_under_unclos"],
      "main_capitals": ["MILITARY", "ECONOMIC", "INSTITUTIONAL"],
      "main_vulnerabilities": ["regional_reputation_cost", "legal_delegitimation"],
      "main_dependencies": [],
      "main_audiences": ["domestic_public", "party_state_elites", "regional_states"],
      "analytical_status": "REVIEW_REQUIRED",
      "evidence_status": "MODERATELY_SUPPORTED",
      "confidence": 0.62
    },
    {
      "schema_version": "1.0",
      "actor_id": "ACT_PHILIPPINES",
      "name": "Philippines",
      "actor_type": "STATE",
      "aliases": [],
      "description": "État côtier demandeur, vainqueur de l'arbitrage de 2016, allié des États-Unis, exposé à la coercition de zone grise.",
      "primary_fields": ["LEGAL", "DIP", "MIL"],
      "claimed_roles": ["lawful_coastal_state"],
      "recognized_roles": ["us_ally", "arbitration_winner"],
      "contested_roles": [],
      "main_capitals": ["LEGAL", "SYMBOLIC"],
      "main_vulnerabilities": ["military_asymmetry", "economic_exposure_to_china"],
      "main_dependencies": [],
      "main_audiences": ["domestic_public", "us_alliance", "asean"],
      "analytical_status": "REVIEW_REQUIRED",
      "evidence_status": "MODERATELY_SUPPORTED",
      "confidence": 0.6
    },
    {
      "schema_version": "1.0",
      "actor_id": "ACT_VIETNAM",
      "name": "Viêt Nam",
      "actor_type": "STATE",
      "aliases": [],
      "description": "État demandeur majeur aux Spratleys et Paracels, combinant fermeté et gestion prudente de sa dépendance économique à la Chine.",
      "primary_fields": ["DIP", "MIL", "ECO"],
      "claimed_roles": ["coastal_claimant"],
      "recognized_roles": ["regional_actor"],
      "contested_roles": [],
      "main_capitals": ["MILITARY", "ECONOMIC"],
      "main_vulnerabilities": ["economic_dependence_on_china", "military_asymmetry"],
      "main_dependencies": [],
      "main_audiences": ["domestic_public", "asean"],
      "analytical_status": "REVIEW_REQUIRED",
      "evidence_status": "MODERATELY_SUPPORTED",
      "confidence": 0.55
    },
    {
      "schema_version": "1.0",
      "actor_id": "ACT_USA",
      "name": "États-Unis d'Amérique",
      "actor_type": "STATE",
      "aliases": ["USA"],
      "description": "Puissance extérieure garante de la liberté de navigation et du traité de défense mutuelle avec les Philippines.",
      "primary_fields": ["MIL", "DIP", "LEGAL"],
      "claimed_roles": ["freedom_of_navigation_guarantor", "alliance_leader"],
      "recognized_roles": ["superpower", "security_guarantor"],
      "contested_roles": ["impartial_external_actor"],
      "main_capitals": ["MILITARY", "INSTITUTIONAL", "NORMATIVE"],
      "main_vulnerabilities": ["credibility_of_commitments", "escalation_management"],
      "main_dependencies": [],
      "main_audiences": ["regional_allies", "domestic_public"],
      "analytical_status": "REVIEW_REQUIRED",
      "evidence_status": "MODERATELY_SUPPORTED",
      "confidence": 0.58
    },
    {
      "schema_version": "1.0",
      "actor_id": "ACT_ASEAN",
      "name": "Association des nations de l'Asie du Sud-Est",
      "actor_type": "REGIONAL_ORGANIZATION",
      "aliases": ["ASEAN"],
      "description": "Organisation régionale cherchant un code de conduite, mais limitée par sa règle du consensus et l'hétérogénéité des intérêts de ses membres.",
      "primary_fields": ["DIP", "INST"],
      "claimed_roles": ["regional_convener", "norm_broker"],
      "recognized_roles": ["regional_forum"],
      "contested_roles": ["effective_collective_actor"],
      "main_capitals": ["INSTITUTIONAL", "SYMBOLIC"],
      "main_vulnerabilities": ["consensus_paralysis", "member_divergence"],
      "main_dependencies": [],
      "main_audiences": ["member_states", "external_powers"],
      "analytical_status": "REVIEW_REQUIRED",
      "evidence_status": "MODERATELY_SUPPORTED",
      "confidence": 0.55
    }
  ],
  "relations": [
    {
      "schema_version": "1.0",
      "relation_id": "REL_CHINA_PHILIPPINES_COERCION_001",
      "source_actor_id": "ACT_CHINA",
      "target_actor_id": "ACT_PHILIPPINES",
      "relation_type": "COERCION",
      "fields": ["MIL", "LEGAL"],
      "description": "Coercition de zone grise (garde-côtes, milice maritime, blocages) autour des récifs contestés.",
      "asymmetry_level": 0.8,
      "trust_level": 0.1,
      "credibility_level": 0.6,
      "reversibility": 0.3,
      "exit_cost": 0.8,
      "main_tensions": ["resupply_blockades", "water_cannon_incidents"],
      "evidence_refs": [],
      "analytical_status": "REVIEW_REQUIRED",
      "evidence_status": "MODERATELY_SUPPORTED",
      "confidence": 0.62
    },
    {
      "schema_version": "1.0",
      "relation_id": "REL_CHINA_VIETNAM_RIVALRY_001",
      "source_actor_id": "ACT_CHINA",
      "target_actor_id": "ACT_VIETNAM",
      "relation_type": "RIVALRY",
      "fields": ["MIL", "ECO"],
      "description": "Rivalité territoriale tempérée par une forte interdépendance économique.",
      "asymmetry_level": 0.65,
      "trust_level": 0.2,
      "credibility_level": 0.55,
      "reversibility": 0.4,
      "exit_cost": 0.6,
      "main_tensions": ["paracels_dispute", "fishing_incidents"],
      "evidence_refs": [],
      "analytical_status": "REVIEW_REQUIRED",
      "evidence_status": "MODERATELY_SUPPORTED",
      "confidence": 0.55
    },
    {
      "schema_version": "1.0",
      "relation_id": "REL_USA_PHILIPPINES_PROTECTION_001",
      "source_actor_id": "ACT_USA",
      "target_actor_id": "ACT_PHILIPPINES",
      "relation_type": "PROTECTION",
      "fields": ["MIL", "DIP"],
      "description": "Traité de défense mutuelle et coopération renforcée (accès aux bases), avec un seuil de déclenchement ambigu.",
      "asymmetry_level": 0.75,
      "trust_level": 0.6,
      "credibility_level": 0.55,
      "reversibility": 0.4,
      "exit_cost": 0.65,
      "main_tensions": ["treaty_threshold_ambiguity", "escalation_control"],
      "evidence_refs": [],
      "analytical_status": "REVIEW_REQUIRED",
      "evidence_status": "MODERATELY_SUPPORTED",
      "confidence": 0.58
    },
    {
      "schema_version": "1.0",
      "relation_id": "REL_CHINA_ASEAN_CONTESTATION_001",
      "source_actor_id": "ACT_CHINA",
      "target_actor_id": "ACT_ASEAN",
      "relation_type": "CONTESTATION",
      "fields": ["DIP", "INST", "LEGAL"],
      "description": "Négociation prolongée d'un code de conduite, où la temporisation sert le fait accompli.",
      "asymmetry_level": 0.6,
      "trust_level": 0.35,
      "credibility_level": 0.5,
      "reversibility": 0.5,
      "exit_cost": 0.5,
      "main_tensions": ["binding_vs_nonbinding_coc", "consensus_paralysis"],
      "evidence_refs": [],
      "analytical_status": "REVIEW_REQUIRED",
      "evidence_status": "MODERATELY_SUPPORTED",
      "confidence": 0.55
    },
    {
      "schema_version": "1.0",
      "relation_id": "REL_USA_CHINA_RIVALRY_001",
      "source_actor_id": "ACT_USA",
      "target_actor_id": "ACT_CHINA",
      "relation_type": "RIVALRY",
      "fields": ["MIL", "DIP"],
      "description": "Rivalité stratégique de fond, dont la mer de Chine méridionale est un théâtre de signalement.",
      "asymmetry_level": 0.4,
      "trust_level": 0.15,
      "credibility_level": 0.6,
      "reversibility": 0.3,
      "exit_cost": 0.6,
      "main_tensions": ["fonops", "incident_risk"],
      "evidence_refs": [],
      "analytical_status": "REVIEW_REQUIRED",
      "evidence_status": "MODERATELY_SUPPORTED",
      "confidence": 0.58
    }
  ],
  "activated_fields": [
    { "field": "MIL", "intensity": 0.82, "role_in_situation": "Coercition de zone grise et présence paramilitaire." },
    { "field": "LEGAL", "intensity": 0.8, "role_in_situation": "Bataille des qualifications juridiques (droits historiques vs UNCLOS)." },
    { "field": "DIP", "intensity": 0.72, "role_in_situation": "Négociation du code de conduite et alignements." },
    { "field": "ECO", "intensity": 0.6, "role_in_situation": "Pêche, hydrocarbures et routes maritimes." }
  ],
  "capital_structure": [
    {
      "schema_version": "1.0",
      "capital_id": "CAP_CHINA_MARITIME_PARAMILITARY_001",
      "actor_id": "ACT_CHINA",
      "capital_type": "MILITARY",
      "field": "MIL",
      "description": "Garde-côtes nombreux et milice maritime permettant une présence coercitive permanente sous le seuil de la guerre.",
      "level": 0.85,
      "convertibility": 0.7,
      "conversion_paths": ["de_facto_control", "fait_accompli", "deterrence_of_claimants"],
      "constraints": ["reputational_cost", "risk_of_triggering_alliance"],
      "evidence_status": "MODERATELY_SUPPORTED",
      "confidence": 0.62
    },
    {
      "schema_version": "1.0",
      "capital_id": "CAP_PHILIPPINES_LEGAL_001",